[
  {
    "date": "2026-08-02",
    "affects": "Handlingsvågens rutnät och löftessidor — 95 löften",
    "what": "Utslagen på sajten var räknade den 25 juli och hade inte räknats om sedan dess, trots att nya kopplingar godkänts löpande. 95 löften visade \"ingen handling ännu\" fastän de hade godkända handlingar bakom sig. Alla utslag är nu omräknade ur registret: 150 löften har utslag i stället för 55. Ingen koppling har lagts till, tagits bort eller ändrat riktning — det som saknades var själva omräkningen.",
    "why": "Utslagen räknas fram av ett skript ur de godkända kopplingarna. Godkännandet sparade kopplingen och byggde om sajten, men ingenting körde omräkningen: den fanns bara som ett kommando att starta för hand. Sajten läste därför en åtta dagar gammal fil utan att något sa ifrån. Skriptets egen dokumentation påstod att en inaktuell fil skulle stoppa bygget; den kontrollen fanns inte. Nu räknas utslagen om i samma steg som kopplingen sparas, och ett test jämför den sparade filen med en omräkning så att samma sak inte kan hända tyst igen. Att \"ingen handling ännu\" är en neutral upplysning och inte en anklagelse gör den inte mindre fel när partiet faktiskt handlat.",
    "commit": "2bdf809"
  },
  {
    "date": "2026-08-05",
    "affects": "Partisidorna /parti/s, /parti/m, /parti/sd, /parti/c, /parti/v, /parti/kd, /parti/l och /parti/mp",
    "what": "Partisidorna visade ett tal, \"utan handling ännu\", som slog ihop två helt olika saker: löften vi sökt igenom utan att hitta någon handling, och löften vi ännu inte sökt på. Talet är nu uppdelat i \"genomsökta utan träff\" och \"ännu inte genomsökta\". Ingen koppling, inget utslag och ingen siffra om vad partierna gjort har ändrats — det är samma löften och samma handlingar som förut, redovisade så att det syns hur långt vi hunnit.",
    "why": "Sökningen efter handlingar gick igenom löftena i den ordning de låg i vår fil, och den ordningen följer parti. En körning som tog slut innan den var färdig stannade därför alltid på samma ställe, och samma partier blev utan gång på gång. Vi kör numera det minst genomsökta löftet först. Ordningen ändrar inte vad som till slut hittas — samma löften och samma handlingar finns där oavsett i vilken ordning vi letar — men den gör att arbetet fördelar sig jämnare medan det pågår. Att bara byta ordning räcker dock inte: så länge en del löften är genomsökta och andra inte, säger ett tomt fält olika saker på olika sidor, och det gick inte att se. Nu står det utskrivet."
  },
  {
    "date": "2026-08-05",
    "affects": "Metodsidan /metod",
    "what": "Metodsidan angav fel orsak till att en del löften saknar vägda handlingar. Det stod att sökningen för nästan en femtedel av löftena inte hittar något dokument alls från partiet att ens pröva, och att det gällde nästan hälften av Liberalernas löften. Båda delarna var fel. Alla de löftena har hundratals eller tusentals egna partihandlingar som skulle kunna prövas. Den verkliga orsaken är att sökningen kräver att löftet och handlingen delar tillräckligt många utmärkande ord, och att korta, allmänt hållna löften inte når dit. Andelen är också en annan i dag: 79 av 467 löften, och för Liberalerna en tredjedel i stället för nästan hälften. Ingen koppling, inget utslag och ingen siffra om vad partierna gjort har ändrats — det var förklaringen som var fel, inte vägningen.",
    "why": "Talen togs fram genom att räkna vilka löften som saknade prövade handlingar, och orsaken antogs vara den gräns som säger att vi bara väger det ett parti självt skrivit under. När saken mättes ordentligt visade det sig att den gränsen inte fällde ett enda av löftena. Det som fäller dem är i stället kravet på ordlikhet mellan löfte och handling, och nästan alla ligger strax under det kravet. Skillnaden spelar roll för läsaren: den första förklaringen låter som att materialet saknas och att inget står att göra, den andra som att gränsen är satt av oss och går att ompröva.",
    "commit": "9133e33"
  },
  {
    "date": "2026-08-06",
    "affects": "Handlingsvågens rutnät och löftessidorna för p-2026-0022, p-2026-0036, p-2026-0040, p-2026-0076, p-2026-0082, p-2026-0101, p-2026-0124 och p-2026-0503 — elva voteringar",
    "what": "Citatet intill elva voteringar visade fel del av betänkandet. Ett citat ska visa vad riksdagen faktiskt beslutade i den punkt som röstades om; i stället stod där utskottets resonemang, en beskrivning av vad ärendet innehöll eller — i ett fall — remissinstansernas invändningar. Alla elva citat är nu utbytta mot voteringspunktens egen beslutstext eller mot utskottets sammanfattning av vad punkten antog, hämtade ur riksdagens öppna data och kontrollerade ord för ord mot källdokumentet. Ett av dem, kopplingen mellan Moderaternas kärnkraftslöfte och omröstningen om ny kärnkraft (NU5 punkt 1), stod dessutom inte ordagrant i sin källa: orden \"kärnkraft\" och \"samtidigt\" hade fått ett extra mellanslag inuti sig när texten hämtades, och citatet sa alltså inte riktigt vad betänkandet säger. Ingen koppling har lagts till eller tagits bort, ingen riktning har ändrats och inget utslag om vad ett parti gjort har ändrats — det som ändrats är vilket stycke ur samma dokument som visas som belägg.",
    "why": "Kravet att belägget ska stå i den del av dokumentet som ÄR handlingen — motionens yrkande, voteringspunktens beslutstext — infördes den 6 augusti 2026 och tillämpades på de förslag som då låg i kö. De kopplingar som godkänts tidigare prövades aldrig mot det nya kravet. En genomgång av samtliga 36 publicerade voteringar samma dag visade att 16 av dem bar ett citat som inte skulle ha passerat. Elva gick att rätta genom att byta till rätt stycke ur samma dokument. Fem gäller punkter som bara avslår motioner utan att visa vad som avslogs; de är inte rättade här utan lämnade för ett eget beslut om kopplingen alls ska stå kvar. Mellanslagsfelet kom av att riksdagens dokument sätts med en formateringstagg per teckenformat, så att ett avstavat ord kunde delas itu när texten hämtades; hämtningen är lagad sedan tidigare samma dag och citatet är omprövat mot den rättade texten.",
    "commit": "b2be8fe"
  },
  {
    "date": "2026-08-06",
    "affects": "Handlingsvågens rutnät och löftessidorna för p-2026-0038, p-2026-0040, p-2026-0042 och p-2026-0318 — fem voteringar borttagna",
    "what": "Fem kopplingar mellan ett löfte och en omröstning är borttagna. Alla fem gällde en punkt där riksdagen enbart avslog motioner, och när vi läste vad som faktiskt avslogs höll kopplingen inte: fyra av dem var ett annat partis förslag, i en annan sakfråga än löftet. Att rösta nej till någon annans förslag är inte att uppfylla sitt eget löfte. Den femte var samma politiska händelse som en koppling vi redan hade — riksdagen avslog först Vänsterpartiets krav på att stoppa förslaget och antog sedan det, två omröstningar om ett beslut, så Moderaternas löfte om försvaret räknades två gånger. Följden: 2 080 partiomdömen blir 2 072 och 10 428 noteringar för enskilda ledamöter blir 9 393. Samtidigt visar vi nu vad som avslogs. En omröstning där riksdagen bara säger nej till en rad motioner gav tidigare bara en lista på nummer intill kopplingen; nu står varje nedröstat förslag utskrivet med sin egen lydelse, hämtad ur motionen och länkad till riksdagens dokument. Det gäller tre kvarvarande kopplingar, alla på Socialdemokraternas löfte om public service.",
    "why": "Ett citat från en sådan omröstning kunde peka ut vilka motioner som föll utan att säga ett ord om vad de begärde — och det gick därför inte att se om kopplingen höll utan att slå upp varje motion för hand. Ingen hade gjort det. När det gjordes föll fem av åtta. Uppgiften fanns hela tiden: punkten anger riksmöte, motionsnummer, parti och yrkandenummer, och lydelsen ligger i motionens egen förslagslista hos riksdagen. Nu hämtas den automatiskt, och ett test stoppar bygget om en sådan koppling saknar den. Kravet gäller också framåt: en ny koppling av det slaget kan inte godkännas utan att det står vad som avslogs.",
    "commit": "85e24fc"
  },
  {
    "date": "2026-08-07",
    "affects": "Handlingsvågens rutnät och löftessidorna för p-2026-0002, p-2026-0007, p-2026-0008, p-2026-0009, p-2026-0015, p-2026-0016, p-2026-0017, p-2026-0018, p-2026-0019, p-2026-0020, p-2026-0021, p-2026-0022, p-2026-0023, p-2026-0024, p-2026-0027, p-2026-0028, p-2026-0029, p-2026-0030, p-2026-0032, p-2026-0034, p-2026-0036, p-2026-0039, p-2026-0040, p-2026-0057, p-2026-0072, p-2026-0074, p-2026-0080, p-2026-0089, p-2026-0105, p-2026-0106, p-2026-0120, p-2026-0121, p-2026-0123, p-2026-0124, p-2026-0126, p-2026-0129, p-2026-0131, p-2026-0133, p-2026-0139, p-2026-0141, p-2026-0142, p-2026-0143, p-2026-0146, p-2026-0152, p-2026-0188, p-2026-0216, p-2026-0218, p-2026-0279, p-2026-0313, p-2026-0317, p-2026-0319, p-2026-0321, p-2026-0322, p-2026-0327, p-2026-0328, p-2026-0331, p-2026-0342, p-2026-0344, p-2026-0345, p-2026-0346, p-2026-0349, p-2026-0351, p-2026-0354, p-2026-0360, p-2026-0373, p-2026-0376, p-2026-0378, p-2026-0382, p-2026-0389, p-2026-0403, p-2026-0405, p-2026-0408, p-2026-0409, p-2026-0413, p-2026-0415, p-2026-0419, p-2026-0420, p-2026-0422, p-2026-0424, p-2026-0427, p-2026-0430, p-2026-0432, p-2026-0438, p-2026-0439, p-2026-0447, p-2026-0448, p-2026-0449, p-2026-0451, p-2026-0454, p-2026-0455, p-2026-0458, p-2026-0459, p-2026-0460, p-2026-0461, p-2026-0469, p-2026-0472, p-2026-0474, p-2026-0475, p-2026-0479, p-2026-0489, p-2026-0490, p-2026-0500, p-2026-0503, p-2026-0513, p-2026-0517, p-2026-0527, p-2026-0546, p-2026-0648 — 177 bevis utbytta",